{
  "$schema": "https://json-schema.org/draft/2020-12/schema",
  "$id": "https://myntmore.local/schemas/raw-lead.json",
  "title": "RawLead",
  "type": "object",
  "required": [
    "lead_id",
    "created_at",
    "source_tool",
    "first_name",
    "last_name",
    "designation",
    "email",
    "company",
    "company_website",
    "linkedin_url",
    "tool_input",
    "tool_output"
  ],
  "properties": {
    "lead_id": { "type": "string", "minLength": 1 },
    "created_at": { "type": "string" },
    "source_tool": { "type": "string" },
    "first_name": { "type": "string" },
    "last_name": { "type": "string" },
    "designation": { "type": "string" },
    "email": { "type": "string" },
    "company": { "type": "string" },
    "company_website": { "type": "string" },
    "linkedin_url": { "type": "string" },
    "tool_input": { "type": "string" },
    "tool_output": { "type": "string" }
  },
  "additionalProperties": false
}
